{
  "$schema": "../schema/site.json",
  "name": "LA DIEGOL",
  "title": "LA DIEGOL — director",
  "description": "LA DIEGOL — director based in Barcelona.",
  "url": "https://ladiegol.com",
  "email": "info@ladiegol.com",
  "social": {
    "instagram": "@ladiegol"
  },
  "loopSlowdown": 1.3,
  "welcome": {
    "on": true,
    "mode": "stills",
    "photos": [
      "are-you-one-of-us/1",
      "aftermatch/1",
      "stripper/2",
      "are-you-one-of-us/6",
      "aftermatch/5",
      "cerca/1",
      "are-you-one-of-us/7",
      "aftermatch/3"
    ]
  },
  "lists": {
    "work": {
      "name": "work",
      "projects": [
        "are-you-one-of-us",
        "aftermatch",
        "no-te-hace-falta",
        "stripper",
        "ringtone",
        "coches-net",
        "llegir",
        "made-to-remember",
        "cerca",
        "yuyo-calm",
        "flooded",
        "por-culpa-del-amor"
      ]
    }
  }
}
